[
  {
    "id": "facade.vcp-main-chat-state",
    "kind": "facade",
    "owner": "renderer.js",
    "facadeName": "VCPMainChatState",
    "status": "pass",
    "consumers": [
      "Flowlockmodules/flowlock-integration.js",
      "modules/VChatAutoTTS/plugin.js"
    ],
    "dynamicSmoke": "scripts/test-electron-main-chat-sequences.mjs",
    "retirement": "retain while Flowlock and AutoTTS plugin consumers use the main-chat state protocol",
    "evidence": [
      "npm run guard:chat-kernel-consumers",
      "npm run test:electron-main-chat-sequences"
    ]
  },
  {
    "id": "facade.main-chat-commands",
    "kind": "facade",
    "owner": "modules/mainChatCommands.js",
    "facadeName": "MainChatCommands",
    "status": "pass",
    "consumers": [
      "modules/ui-system/next-shell/next-shell-controller.js",
      "modules/event-listeners.js"
    ],
    "dynamicSmoke": "scripts/test-electron-ui-apps-smoke.mjs",
    "retirement": "retain while Next shell, Classic menus or plugin commands consume it",
    "evidence": [
      "npm run guard:chat-kernel-consumers",
      "npm run test:electron-ui-apps"
    ]
  },
  {
    "id": "facade.vcp-appearance-studio",
    "kind": "facade",
    "owner": "modules/ui-system/appearance-studio.js",
    "facadeName": "VCPAppearanceStudio",
    "status": "pass",
    "consumers": [
      "modules/ui-system/next-shell/next-shell-controller.js",
      "modules/settingsManager.js"
    ],
    "dynamicSmoke": "scripts/test-appearance-studio.mjs",
    "retirement": "retain while Next shell and settings entrypoints consume it",
    "evidence": [
      "npm run guard:chat-kernel-consumers",
      "npm run test:appearance-studio"
    ]
  },
  {
    "id": "chat.stream.lifecycle",
    "kind": "event",
    "owner": "modules/chat/streamSession.js",
    "status": "pass",
    "producer": [
      "modules/chat/streamSession.js",
      "modules/chat/streamCoordinator.js"
    ],
    "consumers": [
      "modules/renderer/streamManager.js",
      "modules/chat/vcpStreamBridge.js"
    ],
    "mode": "emit",
    "durable": false,
    "terminal": {
      "kinds": [
        "completed",
        "failed",
        "cancelled",
        "discarded"
      ],
      "single": true,
      "late": "discard"
    },
    "sourceEntry": "tests/stream-session.test.mjs",
    "invalidCase": "scripts/fixtures/chat-contract-invalid.mjs",
    "evidence": [
      "npm run test:chat-kernel",
      "npm run test:chat-contract-invariants"
    ]
  },
  {
    "id": "chat.stream.completed.persistence",
    "kind": "event",
    "owner": "modules/chat/streamCoordinator.js",
    "status": "pass",
    "producer": [
      "modules/chat/streamCoordinator.js"
    ],
    "consumers": [
      "modules/chat/chatHistoryPersistence.js"
    ],
    "mode": "emit",
    "durable": true,
    "terminal": {
      "kinds": [
        "completed"
      ],
      "single": true
    },
    "sourceEntry": "tests/stream-coordinator.test.mjs",
    "evidence": [
      "npm run test:chat-kernel"
    ]
  },
  {
    "id": "ui.webawesome.dynamic-event-adapter",
    "kind": "event",
    "owner": "modules/ui-system/webawesome-adapter.js",
    "status": "pass",
    "dynamic": true,
    "dynamicSites": [
      {
        "file": "modules/ui-system/webawesome-adapter.js",
        "line": 150
      }
    ],
    "producer": [
      "modules/ui-system/webawesome-adapter.js"
    ],
    "consumers": [
      "modules/ui-system/webawesome-adapter.js"
    ],
    "mode": "emit",
    "durable": false,
    "terminal": {
      "single": false,
      "late": "surface-scoped"
    },
    "sourceEntry": "scripts/test-webawesome-adapter.mjs",
    "evidence": [
      "npm run test:ui-system"
    ]
  },
  {
    "id": "loom.comfyui.agent-response-bridge",
    "kind": "event",
    "owner": "modules/loom/webcore/comfyui-main-world-bridge.js",
    "status": "manual_required",
    "dynamic": true,
    "dynamicSites": [
      {
        "file": "modules/loom/webcore/comfyui-main-world-bridge.js",
        "line": 271
      },
      {
        "file": "modules/loom/webcore/comfyui-main-world-bridge.js",
        "line": 276
      }
    ],
    "producer": [
      "modules/loom/webcore/comfyui-main-world-bridge.js"
    ],
    "consumers": [
      "modules/loom/webcore/comfyui-page-adapter.js"
    ],
    "mode": "emit",
    "durable": false,
    "terminal": {
      "single": true,
      "late": "request-scoped"
    },
    "evidence": [
      "RESPONSE_EVENT is the constant 'vcp-comfyui-agent-response'; exactly one success or error reply per set-widget-value requestId; no automated test yet"
    ]
  },
  {
    "id": "snapshot.chat-stream.completed",
    "kind": "snapshot",
    "owner": "scripts/test-chat-transcript-snapshot.mjs",
    "status": "pass",
    "snapshot": "docs/contracts/snapshots/chat-stream.json",
    "sourceEntry": "scripts/test-chat-transcript-snapshot.mjs",
    "evidence": [
      "npm run test:chat-transcript-snapshot"
    ]
  },
  {
    "id": "snapshot.chat-stream.cancelled",
    "kind": "snapshot",
    "owner": "scripts/test-chat-transcript-snapshot.mjs",
    "status": "pass",
    "snapshot": "docs/contracts/snapshots/chat-stream-cancel.json",
    "sourceEntry": "scripts/test-chat-transcript-snapshot.mjs",
    "evidence": [
      "npm run test:chat-transcript-snapshot"
    ]
  },
  {
    "id": "snapshot.chat-stream.failed",
    "kind": "snapshot",
    "owner": "scripts/test-chat-transcript-snapshot.mjs",
    "status": "pass",
    "snapshot": "docs/contracts/snapshots/chat-stream-failed.json",
    "sourceEntry": "scripts/test-chat-transcript-snapshot.mjs",
    "evidence": [
      "npm run test:chat-transcript-snapshot"
    ]
  },
  {
    "id": "snapshot.chat-stream.discarded",
    "kind": "snapshot",
    "owner": "scripts/test-chat-transcript-snapshot.mjs",
    "status": "pass",
    "snapshot": "docs/contracts/snapshots/chat-stream-discarded.json",
    "sourceEntry": "scripts/test-chat-transcript-snapshot.mjs",
    "evidence": [
      "npm run test:chat-transcript-snapshot"
    ]
  },
  {
    "id": "preload.registry.channel-adapters",
    "kind": "event",
    "owner": "preloads/core/define.js",
    "status": "manual_required",
    "dynamic": true,
    "dynamicSites": [
      {
        "file": "preloads/core/define.js",
        "line": 65,
        "kind": "event-send"
      },
      {
        "file": "preloads/core/define.js",
        "line": 72,
        "kind": "event-send"
      },
      {
        "file": "preloads/core/define.js",
        "line": 80,
        "kind": "event-listener"
      }
    ],
    "producer": [
      "preloads/core/define.js"
    ],
    "consumers": [
      "preloads/core/expose.js",
      "preloads/api/chat.js",
      "preloads/api/projectForge.js",
      "preloads/api/dice.js",
      "preloads/api/voice.js"
    ],
    "mode": "command",
    "durable": false,
    "terminal": {
      "single": false,
      "late": "caller-owned subscriptions; unsubscribe removes only its own listener"
    },
    "sourceEntry": "tests/preload-registry.test.js",
    "evidence": [
      "node --test tests/preload-registry.test.js: real registry entries built with controlled IPC; query/command argument forwarding and subscription payload shapes/cleanup",
      "node --test tests/chat-event-graph.test.mjs: declaration evidence for all 434 static registry channels",
      "Electron role exposure and all main-process delivery paths still require separate integration evidence"
    ],
    "retirement": "remove this wrapper contract if core/define adapters are retired or their dynamic call sites move; review callers and operation kind before updating sites"
  },
  {
    "id": "source.dynamic.vcpdistributedserver.plugin.ptyshellexecutor.shelloutputpipeline",
    "kind": "source-review",
    "owner": "VCPDistributedServer/Plugin/PTYShellExecutor/ShellOutputPipeline.js",
    "status": "reviewed",
    "dynamic": true,
    "review": "The output channel is constructor configuration (default shell-data); envelopes target the current attached WebContents and carry generation/sequence. Pipeline tests cover backlog and target replacement.",
    "dynamicSites": [
      {
        "file": "VCPDistributedServer/Plugin/PTYShellExecutor/ShellOutputPipeline.js",
        "line": 122,
        "kind": "event-send",
        "match": "activeTarget.webContents.send(this.channel"
      }
    ],
    "evidence": [
      "Source review at integration base 8eb9593a; exact operation matches below; new or changed dynamic sites still fail the contract gate."
    ]
  },
  {
    "id": "source.dynamic.vcpdistributedserver.plugin.ptyshellexecutor.gui.preload",
    "kind": "source-review",
    "owner": "VCPDistributedServer/Plugin/PTYShellExecutor/gui/preload.js",
    "status": "reviewed",
    "dynamic": true,
    "review": "Legacy local ShellViewer preload forwards caller-supplied on/send channels; on returns exact-listener unsubscribe. These methods are generic and not channel-allowlisted. Registration records that existing boundary; it is not a security allowlist approval.",
    "dynamicSites": [
      {
        "file": "VCPDistributedServer/Plugin/PTYShellExecutor/gui/preload.js",
        "line": 14,
        "kind": "event-listener",
        "match": "ipcRenderer.on(channel"
      },
      {
        "file": "VCPDistributedServer/Plugin/PTYShellExecutor/gui/preload.js",
        "line": 28,
        "kind": "event-send",
        "match": "ipcRenderer.send(channel"
      }
    ],
    "evidence": [
      "Source review at integration base 8eb9593a; exact operation matches below; new or changed dynamic sites still fail the contract gate."
    ]
  },
  {
    "id": "source.dynamic.vcpdistributedserver.plugin.powershellexecutor.gui.preload",
    "kind": "source-review",
    "owner": "VCPDistributedServer/Plugin/PowerShellExecutor/gui/preload.js",
    "status": "reviewed",
    "dynamic": true,